,tweet_id,text
53,903186022372065280,いえす
125,903045664774303744,レンタカー借りて関東旅行なう
127,903031164184563712,大阪いたんかw俺だってここまで好条件なとこが宿泊当日に見つかるとは思ってもなかったよww
152,902809283326230530,ちょっとビザ発行してもらえるルートを教えてもらってね
203,902640484333494272,airbnbなのでその趣旨に合ってると思います。一泊1k円だからこんなものかと
220,902439855325495300,幼児出来た了解
221,902436958596546560,ueharaと東京でばったりあったから、飯食いに行こうと思うんだけどなかさんもいっしよにとう
248,902267748977319936,まぁドキュメントもグーグルと違ってめちゃくちゃ見にくいと思ってますし、結局開発者と仲直りしたいってのは建前なんでしょうね
252,902179096251138048,つまり僕は間違いではなかった説
257,902153320520859648,アズアーと読んでた私よりまし
261,902134055461822465,JS
293,902110319148843008,イヤーー
300,902085012664705024,ドライバーに限定はしてるけど、青函フェリーはあえて一般ドライバーを制限はしてないもん
306,902083863467327488,下品な言葉言っちゃだめ
311,902082445234790401,ヒントクーポン利用弘南バス
319,902039367589421061,ルスツ
320,902039269522292736,まだだよ
455,901585834146533377,あちゃ〜北海道バージョンの頃の39パスは既に処分済でなかったです
468,901471499017535488,私も北海道在住かつ北海道イオンMVユーザーだからいつもの北海道限定39パスかと思ったら全国共通でした
469,901470178935844864,来ないようにしてるが報復処置としてランダムに消臭力届きそう
510,901336333641170944,マクドナルド、マジで会計のときにポイントカード持ってんのか聞けだし、dカードみたいな電子マネー一体のカード渡そうが渡さまいがポイントスキャンしたのかしてないのか分かるようにしろだし、非接触カード預かるとか何教育してんじゃ一番アカンやつだろそれ
528,901253167559487488,わかる
529,901231817302228993,ちなみにネイティブ津軽弁は分からないです
538,901229083253587969,FF内から失礼します。東北弁はお年寄りなどの超ネイティブスピーカーとなると他地域民同士では会話が成立不可能なレベルで大きな差異があります
539,901225829086015492,pngファイルでエラー吐いてたので、帰宅したら当方環境でjpeg読んで試してみます
549,901112211329830912,気に入らないが一応出来たには出来たから上げる
550,901110896629395456,とりあえず寝る前にネタとして作りたいものがあり急いでたので切り分けはしてませんでした。少なくとも、python36環境でpillowのみをインポートしてopenとshowのみでコード実行しても症状再現できたとこまでしかやれてないです
571,900927705079619584,なるほどなぁ1ヶ月先に先送りできる点では便利ゾ暗黒微笑
652,900692333649211392,kawaii
658,900681528400687104,夜もドッタンバッタン大騒ぎ
714,900348142654152705,たけのこは真理。たけのここそ全て
770,900192539797475329,それ、病院側に非があったようなもんだし、ゴリ押せばよかったのでは
783,900017754274643968,割とわかるわかる
843,899659319691558913,はい
844,899659192964743168,ん
881,899620659885596672,これは突撃訪問ですね
886,899619436704833536,エロ本入ってたらどうするんですか
942,899265726183161856,忙しかったとはいえど飯さえ食いに行けないほどではないしかも21時頃なんてなおさら
943,899265727659507712,まだわかる。どてまちです
973,899241525455880192,電話絶対殺すマンなので✋
1001,898957451998904320,おいやめろ
1023,898932117366648832,働け
1024,898932057203654656,まぁわかるなお仕事内容
1045,898927744741851140,入りた〜い
1048,898927146382442496,めでたい👏
1050,898926483397238784,寝る
1053,898926124184383488,留年したってその時間で別のことを勉強できるか何もしないか、そういうもんだと思うんだ。
1057,898925678728327169,おっしゃる通りじゃ、
1058,898925559152902145,いや、知らんけど
1126,898886975242895360,な、なるほど
1128,898884159040479232,わかrいや分からない
1174,898598813664919553,「ずーしーほっきー」でおググりください
1189,898565441232060416,クソデカサービスエリア一覧あったので参考にどうぞ
1190,898561965068398592,有料だけど時速120kmくらいで走らないと眠くなるレベルのクソ広くて真っ直ぐな道路とか、普通にショッピングモールのようなサービスエリアとかあるし、サービスエリア跨ぐ区間だけでも金払って乗ってみれば
1192,898560772896313344,そういえば、本州の高速、北海道の高速よりダントツにスペック高いから、是非名古屋周辺走るときは新東名とか新名阪通ってみるといいと思うよ
1193,898559141047746562,おう、
1198,898558058497843202,普通に草wまぁ他に人載せてあの道走るのは普通につらそうそんな道ばかりを攻めるドライブをインターン前にする予定
1225,898481537821298690,分割できるならレジでカード通してだめならレジでエラーになるし、オッケーならそれで決済出来たってなるし
1226,898480958155874309,騙されたと思ってこれらの要件を全部コールセンターのスタッフに伝えなさい
1227,898472721444503552,三井住友は使った事ないからわからんリボ設定外したらだめなの
1228,898471981313441793,カード会社による。全リボ設定してても分割OKのとこは分割払いにするとリボの対象から外されて、リボの額分割額となる。分割手数料無料とかでなければリボの額を変えたほうが楽かとは思う。事情がわからんけど
1229,898471090959155202,なになに
1243,898329919670763524,だから止めたんだよ
1244,898329827861712898,これだよ
1276,898187139850018816,なるほど50点
1280,898186435773186049,どのフレームワークがいいかわからなかったのでとりあえず速度は置いといて高性能そうなdjangoならなんでもできるからええやろと思ってたけど調べたらチャットボット用バックエンドならflaskのほうが良さそう
1285,898185038201733122,交通費宿代全部出してもらえるインターンに1社には参加したので
1289,898184485719515136,報酬5万で宿もやりくりしなきゃだめなのでなかさんもそうしてる
1291,898184131690979328,渋谷からいつもの南千住は遠すぎる
1300,898173454137966595,でしょー明日着てくぞ
1301,898173456457490433,まぁそうなんすよね。金をかけるべき場所がわからないみたいな
1318,898148603427827712,中学の時の西暦を考えろ
1319,898148478542426113,当時は安くはならんかったです。ディズニーリゾートラインでSuica解禁された年ですよ
1323,898147061371031552,家計的に貧乏らしく、その辺の考えが出来んのです。究極の貧乏人は逆に買いだめとかして近い将来のことすら考えられなくなるんです。ってどっかに書いてた
1359,897848416125952000,確か未来大の坂を登る前のt字路信号機は小糸製
1362,897846745492627460,北に来たw
1371,897841361767940096,ガラホからニコ生チャレンジしてましたサウンドオンリーでカメラが上手く機能しなかったので没
1389,897807301758795781,白川郷行くなら、白川郷の帰りに白山スーパー林道ってとこ通るとイイゾ。めっちゃ景色いい。ただ、その予定だと時間的に難しそうだけど
1393,897805634426425344,なるほどその解釈もできるビットコインを当時の相場で4000円≒4k分買ったものが何故か倍の8000円≒8k相当まで価値が上がってた話
1407,897786708330135552,主流ではないがミニストップと同様に店舗数が少ないがゆえの熱狂的ファンが割りといるコンビニ。雰囲気的にはホットシェフのないセコマに近い感じ。パンが期限近くになると値引きされる
1413,897771523678674944,おう。気をつけて愉しんで😎
1414,897771078142918656,貧乏学生だし仕方ないねゲーセン周りはただの都道府県称号獲得のため
1415,897770290469457920,インターン前の2日を使って車中泊しながら東京北部発高速道路不使用、酷道299号経由で小諸市、土合駅、日光いろは坂、栃木と茨城のどっかゲーセンを回る予定です。
1418,897769141003624448,仕方ないね
1421,897768142742499328,自分で招いたことなんだからリボにして、後は支払い終わるまで金使わないことだな
1425,897673314566643712,計算するより、翌月までに返すことの方が重要。1ヶ月だけなら手数料はそこまで掛からない。
1426,897672611534131200,リボ
1447,897662745109295105,esじゃだめですか
1449,897641085849264129,でも日光いろは坂ドライブもしてみたいので悩む
1462,897480789448728577,フロント触るなら避けては通れないし多少はね
1463,897479978186547200,どんな用途に使うのか分からないからあれだけど、アバウトな位置情報でいいならwifiとか3Gの電波基地局から位置推定するAPI使えばいいのでは
1464,897479716231417857,webpack使います
1482,897462412315467776,これじゃない
1483,897461718292484096,グーグルマップ関連でなかった
1493,897452182693335042,なるほど
1500,897449121862307840,なるほど
1504,897447470392680448,え函館いたんですか
1509,897431192978325504,知ってた
1510,897430228494016513,スタイリッシュなUI、gitとの連携、プラグインインストールが簡単。エディタの統合コンソールでエディタを開きながらコマンド実行。各種lint補完プラグイン完備。フォントも選べるよ
1514,897429130043510784,vscodeを使う
1517,897428487958429698,わかるんです
1537,897422885123379200,わかる。ツッコミ入れたくて仕方なかった
1626,896632319917740032,ここは弘前の中三百貨店。青森駅前にもある
1629,896630367058223105,え弘前市民なのに行ったことがない驚き父方の親族の墓がここにある寺並感
1630,896629553623322624,なかさんなかさん行って「なかさん来たw」ってツイートしてなかさん
1633,896625798819401728,なかさん
1692,896326559572742144,MCMRって言うのはね、MisoCurryMilkRamenの略だよ
1712,896299003259658240,ちょっと別のページをゴニョゴニョした時にブログの設定も直さなかったから起きてるくさい。あとで直します
1747,896208786418843649,需要しかなさそうですもんww今度東京行ったとき買いたい
1756,896205777140039680,他の方も言ってましたが、やはりそういうことなんでしょうねぇ。一般のpixivIDを持ってない人にとっては、特になんの登録もせずに直接カードが使えるSquareはそんな購入者にとっては便利だと思うんですがねぇ
1833,895891703642509313,ウニャを食べてウニャウニャ
1834,895891522423406592,ウニャウニャーン
1839,895891128385290240,ウニャーン
1840,895890368662650880,ニャーン
1856,895864579128909824,ありがとナス
1857,895864169035055109,あとでブログかなんかに引用していいですか
1858,895863497552048129,キリスト教の世界では仏なんてものはそもそも居なくてですねうんぬんかんぬん、世界史も知らない人に勧誘されたところで響かない、お祈りの時間を有効活用すべきではなどにもキレイに返してくるのでヤバイ途中からスマホでヘルプツイートに対する説教に変わったので多分語彙は切れてたのかも
1860,895862616085614593,このツイート受け取った直後に親から普通に用事で電話きたので助かりました👏
1864,895857937389764608,トイレの方向と出口が別方向なので、何かいい方法ないですかね
1911,895431035822891013,就活あるはずですし来年なら会えそうですな
1913,895429910319177728,完全に入れ違いですなぁ残念
1916,895265982213636096,早いですが東京行き決まりました確定で9月1日〜12日
1918,895179914680389632,なるほど無知
2001,894847407120203777,東京いました今から帰ります多分また来ます、来たい、会社の金で
2071,894206763712495618,まぁ多分またインターンで来れるでしょう来たい受かれ
2074,894205516896903168,明後日までなお明日明後日合宿インターンでその後終電で帰るので今日しか遊べなかった
2120,894114314876895232,お疲れ様です
2124,894108636393254912,それが情弱ウェイはいとも簡単に引っかかるメルカリとか某洋服通販名前忘れたのツケ払いで問題になったの見れば明らか
2126,894084543413485568,ちらし
2128,894084380443815937,なふだ
2135,894074573892665344,ないんでいいです
2140,894070212785430529,メトロ券でめっちゃ元取れそう
2142,894069957968789504,デメリットはマルイというリア充♡エンターテイメント施設に入らなければならないこと
2143,894069807254876161,それ明日メトロ24h券使う為に乗り換えるだけ
2146,894068345443463168,無理なので東京いるなら即発できるとこで作ればいいのでは。エポスカードならマルイでその場でもらえるで
2162,894056778874314752,ウィッス
2164,894056576046292993,イクイク
2166,894055984728948736,草www
2171,894055375988707328,知ってたかw
2186,894038714531291136,でも首都圏民なのでは
2201,894027490020032513,俺は前のスマホが結構酷かったので現状修正待ちでも満足してるけど、今のスマホで満足してる人間が買い換えるのはあまりオススメできないかもね
2202,894026649154367488,ああ、たしかに症状に覚えあるわ。って感じのがここに羅列されてるので、参考に
2203,894026079513452544,最も致命的なのは通話中にだんだん通話音声品質がどんどん落ちていって最後には相手に自分の声が聞こえなくなることかな。これは流石にふざけるなといった感じこの辺の不具合が次回のファーム更新で直ってくれると信じる信仰心とデザインが好き過ぎて辛い気持ちがあるなら買えばいいんじゃないかな
2204,894025577753042944,まぁ巷で言われる充電中にタッチ精度が極端に落ちてキーボード入力がままならなくなるGPSアプリ使うとごくごくたまーに極端にレスポンス遅くなる暗いときにシャッタースピードが極端に遅くなって絶対ブレるとかはフルコンボだドンなので、まぁファーム待ち開発中らしいって感じ
2221,894016582313062400,そうか、NuansNeoが欲しいのか。そなたは正直でおじゃるな。代わりにお使いを頼まれようぞ▶
2224,893888301408542720,これ
2242,893845595076440064,わーい当たったJDに当てはまりそうな路線はJR東管内全域で考えてもなさそうですね
2248,893836366319992832,JSもあるんでしたっけ湘南新宿ラインとかかな
2258,893831950573617152,行かないです行きたい
2307,893490311212572672,残念ながら普通に男女リーマンカップルでしたね
2315,893484808814247936,悩みましたがモバトクで抑えてしまったので、キャンセル料宿泊費と天秤にかけて諦めることにしました
2317,893482114519252997,今回は日曜日以外はかなりハードスケジュールなんですぞ
2343,893457643313942529,渋谷ですw
2371,893306890708439041,平野な上に周り海だからね、仕方ないね
2408,893259084937306113,あと、もう一つ。現代のウェブサイトはスマホからの利用が78割を占めると言われているので、パソコンでの見た目よりスマホでの見た目を優先してデザイン設計しないと駄目よ。火狐にもあったか知らないけど少なくともChromeだもモバイル表示でのプレビューに対応するから試すといいよ
2412,893248705289101312,実はソースまだ見れてないんだけど、PageSpeeaInsightsの分析結果とアドバイスを元にCSSやJSの読み込み順序、スタイルの適用の仕方とかを見直す動画タグのロゴはgifに直すスマホだと動画は自動再生されない地図のサイズ見直しEZmap使うといいよ
2415,893159825802092544,えっ
2453,892991221068517376,まーまー、気楽にいこーよーCVフェネック
2461,892989504050429952,やめなさい
2462,892989410177802240,死んでしまうような面接なんて捨てちまえ
2463,892989161866743808,だめだろ
2465,892989055452848129,いえあ
2506,892798149105811456,MSはクソって、はっきりわかんだね。やっぱりLinuxですよ。
2530,892535228144566272,もしかして→拒食症
2570,892382595236876292,あとはポイント系がおサイフケータイ対応してくれればRWにケータイ置きっぱなしで喋るだけですべてが終わるのに
2613,892372405452103681,その代わりfor文とかみたいにたまに変な書き方するのもご愛嬌よね
2622,892333243629842432,Pythonはいいぞ少しできる程度だが一番マトモに書けるのこれしかない並感
2650,892203633399349248,PANってプロファイルとしてあるのでやはりプロトコルかと
2652,892202196963434496,あれ、プロトコルではないんか
2690,892035276050059268,ウェルカァム久々に見かけたのでつい
2691,892034958809636864,当たり前だよなぁ
2692,892034406340218880,でも今週末日曜日は東京滞在するものの予定開いてるのですよ
2698,892026996556914689,いいかコミケってのは萌え本ばかりが同人誌じゃないんだぜ
2703,892025749489688577,わかる👍
2704,892025642195144704,それな〜
2805,891675907970154496,👏👏👏👏👏
2813,891570707779297280,全く同じものをフロント左右2基おいてて、センタースピーカーは省いて、ウーハーだけ中古で買って41ch環境を実現。格安サラウンドシステムいいぞ
2816,891568678361219072,それが僕ですので
2829,891556553978806273,1ドライブスピーカーでいいならFOSTEXスピーカーボックスP800Eこれに、お好みのドライバーピンきりを積めばまぁ5000円程度でそこそこの高音質のスピーカーが作れる
2837,891553340772962304,スピーカー自作もありかと
2865,891523096938557442,圧倒的にソニー銀行。ジャパンネット銀行は正直ヤフオクの金が即金で入るのとファミマカードとキャッシュカードが一体にできるくらいしかメリットない。ソニー銀行作るなら俺かに一報いれてね。色々あるので
2953,890960336425148416,バイトの飲み会としては過去最高に楽しかったです
2954,890959633237426177,2次会終わりだし仕方ないね
2969,890884613031182336,それが現在イオンの手によって潰されようとしていますダイエー系列百貨店、なお経営状況
2977,890777202228318208,五稜郭は変わらず潰れたダイエーに代わりシエスタ無印は出来た、駅前が絶賛沈没中なのでトータルでは衰退してる
3054,890413257084686338,ブラウザ用は存じ上げないですねそれこそフィーチャーフォン時代に使ってたおすすめのモバツイはサービス終了しましたのでAndroidの「ESエクスプローラー」というアプリからBluetooth経由でapkファイルをガラホに転送してインストールが安牌かと
3077,890245961309593600,それより有人レジだとあんな感じの表示でるんね蔦屋書店はデフォがセルフレジなので有人レジで通す機会がほぼない
3106,890233504499290113,今気づいたけどほんとだ、しかもQ
3112,890232794370105344,ankerでこれ対応のバッテリーだしてくれー
3149,890090093666590720,沼
3188,889875158004940800,普通に笑うでしょ
3225,889818432983539713,おかげで昭和石川民が産業クソ道路をバイパス出来るんだよなぁ
3230,889809954487508993,楽しい
3273,889664425409495041,バレるんだよなぁ
3274,889664027638456324,嘘なんか。だめだよ嘘ついちゃ
3276,889663854552035332,マジかすげぇ
3277,889663763107926016,ごめんなさい
3280,889663402586521600,そうだよ
3285,889499872788795392,悲しいな
3286,889499786071523328,おめでとう👏👏👏
3287,889499710490148873,いや、現実世界での話
3288,889499581951557633,それ違法なやつじゃない
3289,889499511055241218,流行りの象牙ですか
3441,889282253716455424,ほんとこれ。クソサイトとしてグーグルに通報できる機能が欲しい
3509,889119235712008192,駄目です😫
3512,889117013523615744,何故か北海道ではまるちゃん勢力強いせいなのか同じ価格帯の日清麺職人ばかり値下げしてて辛い
3514,889115940771610625,麺作り味噌は味噌ラーメンカップ麺の中で一番好き。正麺より美味しい
3534,889110724273766400,僕まるちゃん麺作りの味噌にごはんぶっこむの好き
3536,889109016495796225,いいこと聞いたゾ
3537,889108864070688768,これなんだけど、微妙に使いにくいのでアプリ自作したみある
3538,889107998521438208,ちなみに1年以上過ぎてましたが多分乾燥物なので大丈夫です
3617,888784300165873664,実際には部屋にガッチリと効くような空調がないのでそれが抑止力になってる感ある
3619,888744886316302337,正直不思議。知名度と広告戦略ゥですかねぇ
3621,888743519438884864,メルカリアカウント作らされるし、デザインも似てるから間違えても仕方ないかなって感じする。アッテ、取引の敷居が低くて楽だから大型の物とかだとヤフオクよりいい
3622,888742103391416320,メルカリ運営よ。多分さっきのツイのは勘違いかと
3713,888475478528376832,だからそのテレビがないと言ってるやろ
3729,888466728358780928,おお行くか
3764,888454148491845633,この錯誤感がアップルには足りないんですよ違
3773,888421220227481600,kitkat積んでますね
3777,888406170607603712,3000
3808,888358766827061248,ですかねぇ。とりあえず、撮ったあとに必ずブレるので、多分想定されているよりも相当シャッター開放時間長くなってるんじゃないかと思います。明るいとこでもブレるので
3841,888001346179170304,Androidの壁紙をしたガラケーだと思われたかとw
3846,887894326499434496,ウィッス
3847,887882556166754304,金くれ
3850,887873553474793472,早く脱函したい
3852,887870108185407488,これが当たり前に車でされるのが函館一治安と生保率の高い亀田港万代地区ですよ
3876,887640802687565826,ハァハァねぇ君のパンツ何色
3877,887640696340889600,あるわけないやろ〜wwww
3878,887640612954021888,わかる
3879,887640512869482497,5000兆円
3882,887639688084729857,森鴎外
3883,887639615821107200,うんこもりもり
3885,887639347834441728,僕もびっくりだよ
3900,887511287286030336,なるほど
3919,887466299755864064,おめでとうございます
3965,887263641069731840,ぬるぽ
3968,887262422360248322,Heysiri
3979,887147748822204416,見たきゃ見せてやるよ大学にいるなら
3995,887132154093686784,無視してそっとスパブロ
4076,886802430939119616,イオンモール
4134,886570324229185537,ADSLのマンション契約は地獄だなぁそれだと大家さんに光VDSL化してくれと嘆願するしかないかなpingの速度がどれくらい不安定かによってはモデム交換だけで改善の可能性あるかも
4137,886567142342000640,ADSLなら話は変わるけど、ケーブルテレビなら会社に問い合わせてみると色々相談乗ってくれるよ。モデム不調なのか、回線混んでるのか、契約速度上の問題なのかとか
4172,886531959849066496,駅看板がボロくなったのを取り替えていないのかもしれない
4175,886530593881677824,それ廃駅じゃなくてただの無人駅とかない
4177,886511461496872961,ノリとしては僕らは新世界で旅をするみたいな感じで
4181,886509719942078464,任せるが、自転車はなくてもいいかなーと個人的には思ってる
4182,886506748625920004,夏休みてくふぁんドライブ
4190,886505056572289025,はーい
4198,886503986785787905,どこ集合にする
4215,886496019063504896,まぁカード勧誘したくて入ったわけでもないのでもちろん成績いいわけでもないので暇で暇でうちのバイト先に転職するとのことです
4222,886492978113519616,行くかw
4225,886470945853947904,某茸のバイトではスマホ設定補助アルバイトと称してカード勧誘をさせられているそうな
4297,886019116737351680,バイトから戻ったら調べてみるかぁ
