,tweet_id,text
29040,777886076203479041,そういえばやってたなキャンペーンでドコモ口座開設したけどメリットなさすぎて何も使ってないので忘れていた
29054,777850265575706624,まだ未完成なんじゃやめなああああああry
29094,777697229154811904,どういう障害かはわからんけど、アスペルガーとかの部類の障害の場合だとその言い方では言葉の量が多すぎて処理できなくなるので、もっとダイレクトに「俺に一生話しかけるな」とかで言った方がいいと思います。
29095,777695776046624768,歴史的経緯から無理
29164,776924071929925633,知ってる弟から聞いてる
29165,776923867914776576,新習志野駅前の某大学の学生寮にいるので頑張れば歩いて行けるし、電車でも一駅とかいう羨ましさ
29180,776800015360548869,中古PCなんて世代にもよるけど安く性能上げ放題じゃないですかぁ使い道はないけど最大スペックまで上げちゃいましょう
29181,776799460282085380,分からない気付いたら手元に
29182,776798850182897665,Z97チップセットで一番ハイスペックになってると思う馬鹿
29183,776798360887922689,我ながら馬鹿やってるなーと思ってる楽しい
29215,776709654197907456,純粋に勧誘に乗って申し込んだからです。セゾンアメックスの当初の予定としては三井ショッピングかウォルマートの予定でした
29219,776686821417689089,初年度無料なのでとりあえず持っとく。解約料取らないと言ってたので、1年持った後、グリーンアメックスに帰る予定。もしかしたら海外旅行行くかもなので1年だけ年会費払うかも
29222,776682729383469056,ブルーは年会費掛かる一般カード。まぁ普通に取れる
29245,776645946763378689,デビッドは不正利用されたら盗難届が受理されて被害額とか確定して手元に戻るまで資産が減るので危ないからデビッドはプリペイドはおろか、クレカよりも危険
29284,776617455321886724,後からまとめて払うので時間効率的にも無駄がない犯罪などがあっても履歴から辿ればすぐ見つけられ、不正利用分は返金される。現金を財布に入れて持ち歩くより114514倍安心
29343,776453328146354176,ありがたき幸せ
29344,776453237691953152,1135発1525着
29345,776453012780756992,青函フェリー
29346,776452419320328192,自転車ごと来るけど、載せれそうなら迎え欲しいかも
29391,776322590419787776,美味いで
29392,776312152567128064,すいません。秋田に音ゲー称号取りに行きます
29425,776226771460952064,おっそうだな
29430,776218813507395584,昼過ぎから自転車出そうと思ってるし会うのワンチャン
29434,776094905177255936,チラッ
29530,775604584328724480,試しに2階押してみましたが普通に止まってたのでようするに1階上がるだけにエレベーター使うなこんやろーって話だと思います。まさにその通りだと思います
29588,775305033332117506,馬鹿は長生き説
29645,774978121808252932,やはり行動力すごい
29656,774964564844683264,15日か16日に帰るのでそれまでに待って貰えるとありがたい
29658,774963465475661824,使い方による。評判自体はmineo結構いい。あと、もしmineoに確定するなら部屋にmineoのsimカード申し込みクーポンあるから、安く譲るよ
29659,774963089057861632,SAPAは東北道ちゃっちいので、面白みが全くなくてその点EXPASAとかがたくさんある東名名阪阪神新東名とか通ってみたいです
29664,774962223022116865,何より楽しいんですよ。やはり、自転車バイク自動車でそれぞれ違った楽しさや良さがあっていいです〜ただ、東京周辺だと車の方が邪魔になるのは仕方ないですもんね
29666,774961238941970432,車はいいぞ
29721,774852167261761536,にご挨拶して来ましたカメラを忘れたにわかですらないカメラクラスタですらないですが、お話して楽しかったです。満足。
29760,774779022563618816,と三沢基地バーキン
29761,774778519909871616,決済カードは住信sbiデビッド
29765,774772722425409536,日本信号じゃないなにこれ知らんとこのだ
29782,774718874004488192,食べログの600からという情報に騙された
29783,774717970593394688,次の電車出発が629なんだよなぁ
29869,774462965189795840,なるほど
29925,774193583230324736,Microsoftが1年遅かったのよなぁマルチコア化を含めたスマートデバイスシフトそのものが
29926,774191963016798208,なんだとそれは知らなかったでもやはりそれじゃマルチコア化が進んでた当時WPのマルチコア化を遅らせていたMicrosoftが結局戦犯なのではマルチコア対応ならIS12Tも当時考えてた
29972,773828461668413440,DKドンキーコンッ
29975,773825372693475328,ドーンwwwwドーンwwwwドーンキーコーングwwww
30108,773421276283232256,わかる
30113,773409604915134465,ちょっと近所の白神山地まで
30115,773409327369650176,下宿民に依頼
30152,773138688301604864,ウェルカーム
30153,773138497083363328,OSの単位も
30221,772765176873426944,ラーメン
30252,772720470831472640,了解。
30269,772404097714491392,多分、例の職場退職に伴う一般カードへの切替発行処理に伴うものか、純粋にバッチ処理なのを利用して異音で枠を超えて買い物し過ぎたせいか
30295,772276190933491712,家族で車で来てます
30369,771654341996314624,えぇ困惑
30372,771651518529310720,しかし、セール中でも100円より安いやつはそのままに、ハニチュロとかエンゼルクリームみたいに函館価格ではない商品だけ100円になるので良さみが深い
30374,771649432106315776,初めて函館では100円セール中にミスド行ったたときに「なんで100円セールなのに100円より安いんだ」と特に思わずドーナツ買ってましたねω
30375,771648466107768833,帰省中ですが、108円で買うのさえバカバカしくなっててミスド買えなくなってます訴訟
30384,771647820050771969,函館で価格実験やった時の価格をそのままにしてるおかげでエンゼルフレンチでも94円だし、フレンチクルーラーオールドファッションチョコレートは64円やしいいぞ。
30409,771587639556190208,やばい確信
30412,771587425990643716,また見てぇ
30446,771330661114191872,でも、セゾンのアメックスは提携カードとかもあるから簡単に審査通ると思うよ三井ショッピングカード三井アウトレットのカードだとアメックスも選べて年会費無料だしいいと思う
30448,771329432657068032,まぁセゾンのアメックスだからね
30516,770922865235333121,23時の夜行バスで帰るので余韻に浸る暇もなく立川駅に飛び込みましたが日常に戻るのが辛過ぎてつらい
30521,770919214920065024,もちろん。今日は朝9時からマッドマックスシンゴジラ君の名は。と全て爆音上映で見たから頭の中が最高にハイになってます☝՞ਊ՞☝
30565,770829142245777408,あ、なるほどです
30591,770823578610577409,起承転転転転転転転転結転転結って感じで面白かったです
30697,770587347989598208,ダメみたいですね
30703,770583751847923712,ウィッス
30735,770559394207584256,ちな寮は最寄駅どこ秋葉原から乗ってるからよほど遠くなければ金銭的に問題無いし、せっかくだし食いにいこーや
30736,770558736553250816,ウィッス
30737,770558613869834241,あーマジかあちなみに門限何時
30738,770558415374389248,赤羽までなら2022、上野なら2033には着くけどどうする
30741,770557736547258368,明日帰るから今日しかいないのよ
30745,770556780216627202,まだ高崎にいるので余裕があるどころかこっちの方が遅くなりそう上京線で東京方面向かうから、集合する駅教えて
30756,770507022039076864,グンマー国を見学しようと思ってな
30757,770504628593004544,なお、群馬へ抜ける模様
30776,770491380229693440,そんな大変な時期の中暇だからという理由で大まわり旅北回りをしている訳だバカ
30778,770490823259611136,台風のせいで北陸から直接帰れなくなったので東京へ一旦避難してきました
30791,770487326313222148,さっき気づいて出しました長期旅行中につき通信が不安定で気づけませんでした申し訳ないです
30801,770471889571569664,あ、ちなみに打ち直し処理してもらった計算力残念な子はdポイントやらかした男の人とは違って割と美人なお姉さんでしたので許してます
30802,770471239110516736,退勤したら一緒に飯でも食いに行こうや
30828,770412598831386624,どうやら新米だったみたいです。レジの打ち直ししてもらったけど、ポイントの打ち直しが購入金額の1を自動加算する仕組みらしいのだが、担当してもらった店員さん算数すごく苦手なようで、アドバイスするまで「3000円で30P」で繰り返しひたすら打ってて面白かった
30838,770391760854016000,とりあえず例のクーポンがもらえるアンケートアプリでボロクソに書いてやった。打ち直し出来なさそうな気しかしないけど頼み込んで見る
30840,770390845258248192,そもそも、東京なんてdポイント貯められる上に、提示しろとすら書いてるのに、カード見せたら店員は「」って顔してましたよ。ふざけてる
30850,770383913713700865,わかるそれな
30855,770380133714702337,では東京土産を抱えて東京に来る気持ちもだな
30858,770378438867771392,その1時間の暇を潰す飯屋に行くためにまた来た道を引き返すこのつらさがわかるかぁ
30863,770281361907122176,ここの有磯海SAってとこの下りはまだやってた。フードコートはもしかしたら0時で閉めてて、締め詐欺中だっただけかもだけど、売店は普通にまだやってた。中日本高速しゅごい
30892,770261531707658240,そんなことより早く北海道と青森にドミノピザ作ってください
30902,770248620473851906,分からないそれならガルパン比較する
30903,770248518216716288,あと40分後にとりあえず出発するら
30956,770164001976090624,月曜休館だった
30957,770162313944928256,今なんか面白いのやってるん
30966,770148778175176705,少なくとも山形まで行かないとない
30990,770129361177546752,あの花、綺麗に繁華街や中心街をロケしてるので、金沢の名所回りや土産を調達しようとすると必然的に通るルートなんです。
30998,770116618882019328,はーい昨日まで金沢周辺や北陸全般をレンタカーやら友達の車で走り回ったので今日は市内を観光してます
31005,770113504208650240,あっ察し
31012,770112475454967809,2泊3日で、今日が最終日です
31015,770111850352676864,金沢観光中です
31024,770105822248599557,少なくとも山形まで行かないとない
31049,770064568806678529,だから、金沢に居ても青森に帰る手段が普通列車しか無いのwww殆どの高速交通手段も安いバスとかも全部東京経由だから一旦東京行かざるを得ないのです
31050,770061290404536320,一応その予定
31052,770060760420651010,とりあえず東京に向かわないと選択肢がないから、東京へむかう
31053,770060274627903488,それのせいで大変困っておるのですよwww
31054,770055250254434306,まずは青森に帰ることが大事だから
31056,770054229377572864,その金があったら金沢見て回りたいです
31058,770054027010801666,泊まる金すら無いんだよなぁ
31104,769763190364176384,ドリフトしようとしたら砂浜に浸かって脱出出来なくなり掛けたとだけ報告します3」∠
31105,769763031702089728,サイド掛けるタイミングも下手くそなのでこの程度で終わってしまった
31122,769688804676349953,夜もすごかった
31124,769688280560340992,温泉もいいぞ
31127,769670856683327488,え、林道あそこ二輪車通行禁止ではでも国道360号なら同じルート辿るし走ってみたいかな
31130,769670062932230144,そうだったのか名物とか知らんで行き当たりばったり旅だったからなぁあ、でも帰りに白山スーパー林道通って来たけど楽しかった
31131,769669482474184704,魔剤それ早く聴きたかったどぶろく饅頭とどぶろく最中しか買わなかった
31132,769669187111227392,もちろん車やで
31225,769183099984814080,仕方ないやで。
31226,769182650816802817,せやなしゃーない
31229,769179615352856576,実はわいが明日の夜帰るようバス予約すればワンチャンありだったりする
31230,769178947774885889,30日の朝に東京入りだった無理だ
31232,769178099598528514,台風で東京行かなくちゃいけなくなったんですが29〜31日でTDR行くなんてないですよね
31241,769050231136813056,operaの創始者が追放された時点で既にダメだろうなと思った
31314,768797585997836290,強い
31321,768788554272997376,期限切迫品消化中かな
31322,768786326816645120,家に冷凍ラーメン余ってて、なおかつ明日はインターン最終日で飲みに行く可能性が高いにもかかわらず来てしまった
31418,768079917321900032,いえいえ、お昼夕食どきは平日土日問わずいつも大繁盛してますよ。一つ一つ割としっかり手作りしてるんだと思います。美味しいければなんだっていいのです
31420,768078034117070848,ただ、普通にスローフードなのでマックや吉野家のノリで来ると痛い目に合うので、時間に余裕があるときに来た方がいいです
31426,768076724068155393,ラーメン置いてる店もありますし、お好み焼きとかの鉄板焼きがある店もありますし、いいぞ。
31433,768074857556742144,ラッキーピエロはいいですよ。観光客はハンバーガーを頼みがちですが、カツ丼とかオムライス、カレーなどの飯物も最高に美味しいくボリュームたっぷりなのでいいですよ。もちろんハンバーガーも美味しいのでたまに食べたくなります
31441,768070944417984512,函館はファミレスは絶望的に何もないですよ。北海道の典型的な地方都市の例そのまんまです。ココスもねぇガストもねぇサイゼも松屋もみたこたねぇ道内地方都市の中では唯一マシな点としてはこれらの代替となるラッキーピエロがある事でしょうか
31445,768065514472038401,北海道は確か札幌にしかなかったはずですし、東北には仙台以外ほぼ出店ないので、見かける機会がないのです。ロイホやサイゼも同じく
31485,767730409878675456,もう少し早ければ新作の宣伝してきたのに
31503,767695777338527744,だなぁ帰り寄ってみる
31506,767694330915991553,インターンの寮があまりに住宅街故、徒歩で行ける範囲のコインランドリーがここしかなかった
31507,767693991311618048,いえあ
31509,767693364061798400,つまり僕はコインランドリーの機械のメンテも悪ければ洗剤の自販機もない超大外れ店を掴んでしまったのだろうか
31510,767693038797807616,ある店もあるんです今来てるとこには少なくとも無い
31547,767354368760819712,1週間暮らすための資材集めに暑く湿度の高い中見知らぬ土地を歩き回った後の至福のひと時でした
31560,767326792935800832,ピッピッピップー静かにモーター音が鳴り響く
31639,767153612782841856,はい
31642,767144794783043585,今日の14時には金沢に出発してしまうんだ申し訳ねぇ予約取れなかった
31648,767143066520068097,ωやぁ秋葉行って午後には移動するけど軽くオフるかい
31661,767008568922955777,165円411円194円133円216円216円計1335円都区内パス750円585円得した
31687,766963662137405442,行かないです
31688,766963251343011840,そんな金ないです
31728,766865125714202626,止まった農産研修センターからの景色でさえこんな感じ
31730,766864514784440320,帯広とかまでいくとマジで無限に畑が広がる。30分走っても景色が変わらないレベル
31736,766860508154564608,現に一緒に始発駅でグランクラスに乗り込んだ老夫婦が「飛行機のファーストクラスみたいだやばい」みたいな感じで終始ずっと写真撮ってたので、そんな感じです
31741,766859262228172800,騙されたと思って乗ると普通車でも十分快適だという言葉に今まで騙されてきたことに気づいてしまいます
31747,766857956570771456,お金があったらまた乗りたいグランクラスはいいぞ
31775,766834389586108417,そこまで融通効くんですね楽しみです
31777,766834006264459264,思ってたよりガッツリでびっくりさっき立ち食いそば食べて来ちゃったのに食べれるかな
31804,766817472359964672,鼻炎罹ったら行くまであるでも北美原クリニックタウンだっけの中の耳鼻科の方が近いんだよなぁうーん
31808,766816680232169472,プロが揃ってる上に大学病院が無いから人体実験される可能性も無いから実は医療環境だけは良いのでは説
31809,766816217663361025,大人になってから喘息罹ったらこの2つのどちらかに行くのがいいらしいです。共愛会に限っては大人喘息のプロだそうで
31810,766815708193787908,「呼吸器専門の病院」で絞るとこの2つしか選択肢がないようで。
31830,766761461402050560,おかげでシンゴジラ極爆回に間に合わない僕の気持ちをですねなんとかならないか調整中
31846,766563280466743297,ほぼ満席に近い状態やで。スタンダード席ですら居場所争奪戦だった
31885,766468813651005440,はい
31886,766468611456151553,できそうよろしく
31902,766441527480422400,プリン作ろう
31930,766307952059822081,あれ、dカードminiは対象外だったようなむしろそれなら私がdカード持つ意味が無くなってしまう今更なリプゴメンナサイ
31980,766108225309511681,おすすめは新幹線っす。モバイルSuicaで乗れば15000円年会費1000円で、朝の便使えば12時少し前につく
31982,766106414246825985,3列シートのバス取れば割りと快適だしいいよ。おまけに夜中のうちに移動できるから時間効率的には下手に飛行機とか新幹線使うよりいいと思う。飛行機の早割だと、便利な朝一便は高かったりするから
31983,766105731523239936,都内へ移動1000円くらいはかかると見積もると、わりとトントンだったりする。まあ12月なんだったら早めにチケット取れば安上がりだしいいんじゃないかな。あとてまーくんの勧めてる東京函館切符も、時間が許すならお得だしおすすめ
31986,766101110436179968,45日以上前からであれば早割の効く飛行機のほうが最安13k16k円、それ以降は当日の空き席に乗るスカイメイトで19k円。新幹線は学割利用で20k円。モバイルsuicaの枚数限定割引きっぷで15k円
32009,766058292586033152,東北新幹線は確か最初からもう自販機おいてなかった気が
32014,766057570544918528,you頼んじゃいなyo
32020,766056907224125440,東京旅行日に開催中のイーグルジャンプ秋葉原イベントに行くしかない
32030,766047979862040576,へぇじゃあクレカで年確やろうと思えば簡単に出来るんだな
32068,765890406902960128,デスヨネー
32069,765890135544123392,i74771を2万くらいで買わない
32071,765872531832090624,プロ
32076,765849806564491264,じじいも乗るんだよあくしろよ
32077,765831365480763392,よし、今度みんなでドライブしよういろは坂でも行ってみるか
32079,765828973150412800,コミケ行ったことないけど行ってみたくなるくらい素晴らしい
32113,765706900595814401,あ〜いいっすね〜
32114,765702751481270272,これにツクモとかなら「ではさらにtitan×3とか積めば完璧ですねところで何に使うパソコンですかこれ」って突っ込まれそうだけど、PCデポならたぶん無限に待たされて店員たらい回しにされそう
32148,765512369548046340,ケーブル貸すか
32157,765504830014038017,あと、北海道内には幸運にもPCデポはないのでご安心ください
32158,765504308590759936,まっっっっっっっったく違いますし、資本関係も一切ないのでご安心ください。ツクモはヤマダ電機傘下とは言えど、PCパーツエリアは自作er向けの商売しかしてませんので
32179,765463845980676096,あまりに話合い過ぎて感動した
32180,765463608385908736,昨日一昨日辺りにこの特殊性癖に理解ある方見つけてしまい別垢作った話する
32182,765462902476156928,おめでとうございます
32183,765461040364593153,んω
32189,765424480638291968,それでいい́ω
32190,765413939081453568,まるでヒマワキシティのようなと言って欲しいかな
32193,765412395409821696,シュッ
32215,765344364142800896,そう言われてみればそうですねぇ〜面白いケースだ
32231,765331027849916416,だってお盆だから保健センターくらいしかまともに開いてるとこなかったゆだもんって生協110番の人が言ってた
32232,765330748702281728,一昨日保健センターで診てもらって薬貰ってるんだけど、また行ってみた方がいいかな
32245,765212141787844610,はへぇってあれダイエー町田って、最近オープン実質建て替えしたばっかなのにダイエーPOSなんですか
32250,765209324117368832,あら、そうなのかぁ。ということは、もしかしてセルフレジでハートポイントの画面の時にWAONPOINTカード入れると反応するかも今度実験してみよう
32257,765205912101322752,ちなみに、その寺岡のレジでハートポイントの読み取りが出来てたので、WAONPOINTの基礎となるシステムはマジでハートポイントからそっくりそのまま移したやつじゃないかなと
32258,765205692802228226,近所の転換店舗は全部寺岡のが導入されてましたね。ただ、WAONチャージャーだけが2店舗のうち片方が新型の現金ポイントチャージのみ対応機で、もう片方が何故かセルフレジを流用した現金のみ対応のチャージャーが入ってて、何故ってなりました
32260,765203461604421634,なんだこれはちゃんぽんし過ぎ最近はダイエー転換店舗とマックスバリュ店舗のPOSしか見てなかったのでこんなのもあるんですねぇ
32264,765199807434534913,変態だーイオンはポイントカードもそうだけどPOS関連の設備もいい加減統一した方がいいのでは
32265,765196053213622272,あれーそうだったのかーそれより、前から見てたこのイオンの見かけない寺岡の精算機、イオン仕様のセミセルフ機だったんですね
32276,765185213395640320,色々言ったけどダメでした容疑者は金のかかりやすい乗り物趣味に手を広げすぎたとか言って
32278,765184485696561152,あるけどさぁスポーツバイクの沼に引きずり入門させるならママチャリ魔改造なんかに金費やすなら金貯めてクロスバイクかロードバイク買わせたいなって
32280,765180224346595328,でも、外部端末らしきものは見当たらなかったんですよねぇ見えてなかったor出してなかっただけかもですが
32327,765074483719708673,あっハイ
32328,765074032026718208,食品レジ前かビューティコーナーのどこかにあった覚えがもう遅いかな
32329,765072867054596096,そういえば薄い本入ってそうな荷物届いてたんで部屋の机に置いといたで
32333,765049413370720256,それは君を人が避けるように訓練されているからだ
32362,764996357966864384,パソコン起動するやで。設定に必要なフリーソフト一時的に入れるやで。からの「サービスパックを導入してください」「アップデートが必要です」とか
32372,764992781685108736,ないです。
32415,764824076699308032,•ωチラッ
32427,764817093866889216,ネットで調べてくれ個人的にはそれほどないように思える
32433,764815056202633217,流石にそれだと幅に差がありすぎかと25c28Cならアリかもだけど
32457,764763915360149504,意外とコンパクトで、長さはあるけど細いし軽いからとても良い
32470,764721326082756608,なぜかAmazonURLついてなかった
32471,764720966563864576,自転車にもロードサービスがあるんですよ。しかも自転車用ロードサービスが付帯するのは今現在でもau損保だけ
32495,764655976855199744,BRIDGESTONEブリヂストンフレームポンプゲージ付PMSP081ブラック
